{
  "media_id": "media-place1-name-be",
  "sha256": "e3b0c44298fc1c149afbf4c8996fb92427ae41e4649b934ca495991b7852b855",
  "bytes": 48213,
  "mime": "audio/mp4",
  "duration_s": 4,
  "locale": "be",
  "voice_id": "voice-be-1",
  "license": "CC BY-SA 4.0, запіс аўтара KUDY",
  "credit": "Аўтар дэма, 2026"
}
